<?xml version="1.0" encoding="utf-8"?>
<!-- a sample document -->
<!DOCTYPE itemMetadata SYSTEM "https://raw.githubusercontent.com/CalJacobson/ArchiveMetadataInterchangeFormat/master/draft.dtd">
<itemMetadata version="0.01">
  <id>ddefefc8-f450-4b92-a9ea-8b1dd92dd777</id>
  <name autogenerated="false">Initech New Hire Video</name>
  <description>Required training for all new employees.</description>
  <category id="f8ef5fc8-f450-4b92-a9ea-8b1dd92de777">Training Videos</category>
  <tags>
    <tag id="f8ddefc8-f450-4b92-a9ea-8b1dd92de113">new hires</tag>
    <tag id="f8ddefc8-f450-4b92-a9ea-8b1dd92de233">sleeping aids</tag>
  </tags>
  <file>
    <mimeType>video/mp4</mimeType>
    <filename>welcome.mp4</filename>
    <filesize>1133221001</filesize>
    <duration>1:35:34</duration>
    <videoMetadata>
      <stream>
        <id>0</id>
        <type>Video</type>
        <codec>H264 - MPEG-4 AVC (part 10)</codec>
        <resolution>
          <width>1920</width>
          <height>1080</height>
        </resolution>
        <framerate>30</framerate>
        <bitrate>9599kbps</bitrate>
      </stream>
      <stream>
        <id>1</id>
        <codec>MPEG AAC Audio (mp4a)</codec>
        <type>Audio</type>
        <channels>Stereo</channels>
        <sampleRate>44100 Hz</sampleRate>
        <bitsPerSample>32</bitsPerSample>
        <bitrate>127kbps</bitrate>
      </stream>
    </videoMetadata>
  </file>
  <ownership>
    <organization>
      <id>612347a8-fb63-4308-80c6-607bc72ea333</id>
      <name>Initech Inc.</name>
      <phone>(555) 555-1212</phone>
      <url>http://www.initech.com</url>
    </organization>
  </ownership>
  <copyright>2002 Initech Inc.</copyright>
  <license>
    <name>MIT License</name>
    <url>https://choosealicense.com/licenses/mit/</url>
  </license>
</itemMetadata>