<?xml version="1.0" encoding="utf-8"?>
<!-- a sample document -->
<!DOCTYPE itemMetadata SYSTEM "https://raw.githubusercontent.com/CalJacobson/ArchiveMetadataInterchangeFormat/master/draft.dtd">
<itemMetadata version="0.01">
  <id>f8efefc8-f450-4b92-a9ea-8b1dd92de822</id>
  <name autogenerated="false">2020 Contingency Plan (FINAL)</name>
  <description>Document that outlines our organization's plans in case something goes pear-shaped.</description>
  <file>
    <mimeType>application/pdf</mimeType>
    <filename>2020_cont_plan.pdf</filename>
    <filesize>3221001</filesize>
  </file>
  <ownership>
    <author primary="true">
      <id>612347a8-fb63-4308-80c6-607bc72ea260</id>
      <lastName>Bland</lastName>
      <firstName>Terry</firstName>
      <emailAddress>tbland_bogus@gmail.com</emailAddress>
    </author>
    <author>
      <id>612347a8-fb63-4308-80c6-607bc7211160</id>
      <lastName>Floof</lastName>
      <firstName>Jenny</firstName>
      <phone>(555) 555-1212</phone>
    </author>
    <author>
      <id>612347bb-fb63-4308-80c6-607bc7211123</id>
      <lastName>Bling</lastName>
      <firstName>Gary</firstName>
      <url>http://www.garybling.com</url>
    </author>
  </ownership>
  <versioning>
    <currentVersion>
      <versionNumber>3</versionNumber>
      <versionDateTime>2019-08-01 16:45:32</versionDateTime>
      <versionStatus id="f8efefc8-f450-4b92-a9ea-8b1dd922e852">Final</versionStatus>
    </currentVersion>
    <history>
      <version>
        <versionNumber>2</versionNumber>
        <versionDateTime>2019-08-01 16:45:32</versionDateTime>
        <versionStatus id="f8efefc8-f450-4b92-a9ea-8b1dd922e111">Draft</versionStatus>
      </version>
      <version>
        <versionNumber>1</versionNumber>
        <versionDateTime>2019-07-28 16:45:32</versionDateTime>
        <versionStatus id="f8efefc8-f450-4b92-a9ea-8b1dd922e111">Draft</versionStatus>
      </version>
    </history>
  </versioning>
</itemMetadata>